{
  "$schema": "../_canonical_schemas/registry.schema.json",
  "_meta": {
    "description": "Workflow Registry - Lists all available workflow packages with metadata",
    "purpose": "Used by CLI to discover and list available workflows"
  },
  "schema_version": "1.1",
  "default": "planning",
  "workflows": {
    "planning": {
      "path": "planning/",
      "name": "Software Planning Workflow",
      "description": "15-agent pipeline for comprehensive software project planning",
      "version": "1.0.0",
      "agents": 15,
      "stages": 8,
      "config_present": true,
      "status": "stable",
      "tags": ["software", "planning", "architecture", "requirements"]
    },
    "implementation": {
      "path": "implementation/",
      "name": "Code Implementation Workflow",
      "description": "6 core + 4 on-demand agents for TDD-based code implementation",
      "version": "1.0.0",
      "agents": 10,
      "stages": 8,
      "config_present": true,
      "core_agents": 6,
      "on_demand_agents": 4,
      "status": "stable",
      "requires": "planning",
      "tags": ["coding", "development", "testing", "tdd"]
    },
    "research": {
      "path": "research/",
      "name": "Research Workflow",
      "description": "8 core + 4 on-demand agents for evidence-based academic research",
      "version": "1.0.0",
      "agents": 12,
      "stages": 6,
      "config_present": true,
      "core_agents": 8,
      "on_demand_agents": 4,
      "status": "stable",
      "tags": ["research", "academic", "writing", "publication"]
    },
    "workflow-creation": {
      "path": "workflow-creation/",
      "name": "Workflow Creation Workflow",
      "description": "9-agent meta-workflow for creating new workflow packages",
      "version": "1.0.0",
      "agents": 9,
      "stages": 4,
      "config_present": true,
      "status": "stable",
      "tags": ["meta", "workflow", "creation", "tooling"]
    }
  }
}
